<?xml version="1.0" encoding="UTF-8"?>
<!DOCTYPE universidad SYSTEM "Ejercicio2.dtd">
<universidad>
    <departamento codigo="D1" tipo="ciencias">
        <nombre>Matemáticas</nombre>
        <profesor id="P001" jefe="true">
            <nombre>Carlos Ruiz</nombre>
            <asignaturas>MAT101 MAT102</asignaturas>
        </profesor>
        <aula numero="A101" capacidad="50" recursos="proyector pizarra"/>
    </departamento>
    
    <alumno id="A001" matriculas="MAT101 MAT102">
        <nombre>Ana López</nombre>
        <telefono tipo="móvil">600123456</telefono>
    </alumno>
    
    <asignatura codigo="MAT101" departamento="D1" creditos="6">
        <nombre>Álgebra Lineal</nombre>
        <horario dia="L" hora="09:00"/>
    </asignatura>
</universidad>